"@context":"https://schema.org/","@type":"Product","name":"Velvet Sweetheart Twist Floral Bell Sleeve Mini Dress","image":["https://img1.shopcider.com/product/1666836416000-TwxPBR.jpg"],"url":"https://www.shopcider.com/goods/velvet-sweetheart-twist-floral-bell-sleeve-mini-dress","description":"Velvet Sweetheart Twist Floral Bell Sleeve Mini Dress","sku":"CD20221008188600MD","brand":{"@type":"Brand","name":"Cider"},"offers":{"@type":"Offer","url":"https://www.shopcider.com/goods/velvet-sweetheart-twist-floral-bell-sleeve-mini-dress","priceCurrency":"CAD","price":"30.00","priceValidUntil":"2023-03-07","itemCondition":"https://schema.org/NewCondition","availability":"https://schema.org/InStock"},"aggregateRating":{"@type":"AggregateRating","ratingValue":"4.4","reviewCount":"48"},"review":[{"@type":"Review","datePublished":"2022/12/29","name":"Absolutely PERFECT dress! I am in love with this dress and I’m so excited to wear it out and about!!","reviewBody":"Absolutely PERFECT dress! I am in love with this dress and I’m so excited to wear it out and about!!","reviewRating":{"@type":"Rating","ratingValue":"5","bestRating":"5"},"author":{"@type":"Person","name":"g***7"}},{"@type":"Review","datePublished":"2022/12/27","name":"Gorgeous dress! Just like photographed! Great material and true to size :) I’m 5’5 and 180lbs and this was perfect on me ","reviewBody":"Gorgeous dress! Just like photographed! Great material and true to size :) I’m 5’5 and 180lbs and this was perfect on me ","reviewRating":{"@type":"Rating","ratingValue":"5","bestRating":"5"},"author":{"@type":"Person","name":"v***n"}},{"@type":"Review","datePublished":"2022/12/11","name":"I love this dress! I went with my recommended size and everything is great but the shoulders are a bit wide, but I still love it ","reviewBody":"I love this dress! I went with my recommended size and everything is great but the shoulders are a bit wide, but I still love it ","reviewRating":{"@type":"Rating","ratingValue":"4","bestRating":"5"},"author":{"@type":"Person","name":"a***l"}},{"@type":"Review","datePublished":"2022/12/06","name":"Den passage jätte bra men var lite kort bara, men köp denna. Färgen var så fin!!!","reviewBody":"Den passage jätte bra men var lite kort bara, men köp denna. Färgen var så fin!!!","reviewRating":{"@type":"Rating","ratingValue":"5","bestRating":"5"},"author":{"@type":"Person","name":"r***6"}},{"@type":"Review","datePublished":"2022/12/06","name":"This dress is beautiful; Exactly as depicted. ","reviewBody":"This dress is beautiful; Exactly as depicted. ","reviewRating":{"@type":"Rating","ratingValue":"5","bestRating":"5"},"author":{"@type":"Person","name":"C***K"}},{"@type":"Review","datePublished":"2022/12/01","name":"It was my firs order. Dress is verry pretty.I love it. But for me it seems little small. It needs to order size M or loose weight haha.","reviewBody":"It was my firs order. Dress is verry pretty.I love it. But for me it seems little small. It needs to order size M or loose weight haha.","reviewRating":{"@type":"Rating","ratingValue":"5","bestRating":"5"},"author":{"@type":"Person","name":"l***h"}},{"@type":"Review","datePublished":"2023/01/21","name":"I loved this dress, it was so beautiful on ❤️\\nI got it in xs, because i am very short.","reviewBody":"I loved this dress, it was so beautiful on ❤️\\nI got it in xs, because i am very short.","reviewRating":{"@type":"Rating","ratingValue":"5","bestRating":"5"},"author":{"@type":"Person","name":"a***d"}},{"@type":"Review","datePublished":"2023/01/18","name":"is a little sort and the shoulders are a bit too wide but overall it’s a really nice dress- might have to wear a jacket so no one can see the mess of the shoulders :)","reviewBody":"is a little sort and the shoulders are a bit too wide but overall it’s a really nice dress- might have to wear a jacket so no one can see the mess of the shoulders :)","reviewRating":{"@type":"Rating","ratingValue":"4","bestRating":"5"},"author":{"@type":"Person","name":"a***t"}},{"@type":"Review","datePublished":"2023/01/17","name":"So gorgeous! Really heavy, good material. It’s so velvety and lovely! The dress is really flattering aswell ","reviewBody":"So gorgeous! Really heavy, good material. It’s so velvety and lovely! The dress is really flattering aswell ","reviewRating":{"@type":"Rating","ratingValue":"5","bestRating":"5"},"author":{"@type":"Person","name":"a***8"}},{"@type":"Review","datePublished":"2023/01/12","name":"Beautiful but didn’t suit. ","reviewBody":"Beautiful but didn’t suit. ","reviewRating":{"@type":"Rating","ratingValue":"3","bestRating":"5"},"author":{"@type":"Person","name":"m***r"
"@context":"https://schema.org/","@type":"Product","name":"Solid Ruffle Lace Up Mini Dress","image":["https://img1.shopcider.com/product/1663678059000-P5Zx2b.jpg"],"url":"https://www.shopcider.com/goods/solid-ruffle-lace-up-mini-dress","description":"Solid Ruffle Lace Up Mini Dress","sku":"CD20220803150148MD","brand":{"@type":"Brand","name":"Cider"},"offers":{"@type":"Offer","url":"https://www.shopcider.com/goods/solid-ruffle-lace-up-mini-dress","priceCurrency":"CAD","price":"49.00","priceValidUntil":"2023-03-07","itemCondition":"https://schema.org/NewCondition","availability":"https://schema.org/InStock"},"aggregateRating":{"@type":"AggregateRating","ratingValue":"4.5","reviewCount":"11"},"review":[{"@type":"Review","datePublished":"2023/01/05","name":"Cute and sexy witch/pirate themed attire but pretty tight and unforgiving. I don’t mind the length but could def be considered too short depending on your event. The shoulders fit a bit odd too. I’m 5’7”, 150ish lbs, 34DDD bust for reference. ","reviewBody":"Cute and sexy witch/pirate themed attire but pretty tight and unforgiving. I don’t mind the length but could def be considered too short depending on your event. The shoulders fit a bit odd too. I’m 5’7”, 150ish lbs, 34DDD bust for reference. ","reviewRating":{"@type":"Rating","ratingValue":"4","bestRating":"5"},"author":{"@type":"Person","name":"a***5"}},{"@type":"Review","datePublished":"2022/12/30","name":"The dress was lovely , so beautiful.  However , (and I recommend this tip for any dress you buy ) you should get a size bigger than you usually get as I think the sizing is a little different here on cider . I put it on and it was amazing in the hips and bust however way to small in the shoulders and waist, the zipper did not want to zip up at all . I also recommend getting a plunge style bra or something that will  not show with a square neckline.","reviewBody":"The dress was lovely , so beautiful.  However , (and I recommend this tip for any dress you buy ) you should get a size bigger than you usually get as I think the sizing is a little different here on cider . I put it on and it was amazing in the hips and bust however way to small in the shoulders and waist, the zipper did not want to zip up at all . I also recommend getting a plunge style bra or something that will  not show with a square neckline.","reviewRating":{"@type":"Rating","ratingValue":"4","bestRating":"5"},"author":{"@type":"Person","name":"z***6"}},{"@type":"Review","datePublished":"2022/12/07","name":"But small in the arms and bust. Cute if you don’t lift your arms","reviewBody":"But small in the arms and bust. Cute if you don’t lift your arms","reviewRating":{"@type":"Rating","ratingValue":"4","bestRating":"5"},"author":{"@type":"Person","name":"d***0"}},{"@type":"Review","datePublished":"2022/12/07","name":"it fits good but one as a size bigger","reviewBody":"it fits good but one as a size bigger","reviewRating":{"@type":"Rating","ratingValue":"4","bestRating":"5"},"author":{"@type":"Person","name":"a***3"}},{"@type":"Review","datePublished":"2022/11/04","name":"too tight, my measurements listed. felt comfy though and wish it had fit. ","reviewBody":"too tight, my measurements listed. felt comfy though and wish it had fit. ","reviewRating":{"@type":"Rating","ratingValue":"5","bestRating":"5"},"author":{"@type":"Person","name":"c***n"}},{"@type":"Review","datePublished":"2022/10/22","name":"i loved the design but unfortunately it didn’t fit me, but i would definitely buy in a bigger size ","reviewBody":"i loved the design but unfortunately it didn’t fit me, but i would definitely buy in a bigger size ","reviewRating":{"@type":"Rating","ratingValue":"5","bestRating":"5"},"author":{"@type":"Person","name":"l***6"}},{"@type":"Review","datePublished":"2022/11/18","name":"Very beautiful dress, but a bit small in breast. ","reviewBody":"Very beautiful dress, but a bit small in breast. ","reviewRating":{"@type":"Rating","ratingValue":"5","bestRating":"5"},"author":{"@type":"Person","name":"d***8"}},{"@type":"Review","datePublished":"2022/10/27","name":"주름이 잘 가는 재질인가봐요 세탁은 아직 안 해봤는데 잘 펴서 말리지 않으면 주름잔치할 듯.\\n일단 코르셋부분 끈을 아주 넉넉히 풀어놓고 입어서 줄 조절을 해야해요\\n어깨 부분은 상당히 많이 벌어져있어서 속옷끈이 보이는게 싫으면 투명브라끈을 하거나 아예 안해야돼요.\\n가슴앞쪽도 꽤 많이 파였어요.\\n전체적인 길이는 생각보다 안 짧아서 너무 좋아요 크게 신경쓰이지 않으면 속바지 안 입어도 돼구요.\\n가을 중간정도부터 늦가을 오후에 잠깐 더울 때 까지는 충분히 입겠어요.\\n너무너무 사랑스러운 옷이에요.","reviewBody":"주름이 잘 가는 재질인가봐요 세탁은 아직 안 해봤는데 잘 펴서 말리지 않으면 주름잔치할 듯.\\n일단 코르셋부분 끈을 아주 넉넉히 풀어놓고 입어서 줄 조절을 해야해요\\n어깨 부분은 상당히 많이 벌어져있어서 속옷끈이 보이는게 싫으면 투명브라끈을 하거나 아예 안해야돼요.\\n가슴앞쪽도 꽤 많이 파였어요.\\n전체적인 길이는 생각보다 안 짧아서 너무 좋아요 크게 신경쓰이지 않으면 속바지 안 입어도 돼구요.\\n가을 중간정도부터 늦가을 오후에 잠깐 더울 때 까지는 충분히 입겠어요.\\n너무너무 사랑스러운 옷이에요.","reviewRating":{"@type":"Rating","ratingValue":"5","bestRating":"5"},"author":{"@type":"Person","name":"c***1"}},{"@type":"Review","datePublished":"2023/02/05","name":"comfy","reviewBody":"comfy","reviewRating":{"@type":"Rating","ratingValue":"5","bestRating":"5"},"author":{"@type":"Person","name":"g***4"}},{"@type":"Review","datePublished":"2023/01/26","name":"A little tight in the shoulder area but overall fit very well. Looked just like the picture and was good quality!","reviewBody":"A little tight in the shoulder area but overall fit very well. Looked just like the picture and was good quality!","reviewRating":{"@type":"Rating","ratingValue":"5","bestRating":"5"},"author":{"@type":"Person","name":"s***e"
"@context":"https://schema.org/","@type":"Product","name":"Solid Cowl Neck Slit Midi Dress","image":["https://img1.shopcider.com/product/1643096623000-aMBYAR.jpg"],"url":"https://www.shopcider.com/goods/solid-cowl-neck-slit-maxi-dress","description":"Solid Cowl Neck Slit Midi Dress","sku":"CD2021112543830LD","brand":{"@type":"Brand","name":"Cider"},"offers":{"@type":"Offer","url":"https://www.shopcider.com/goods/solid-cowl-neck-slit-maxi-dress","priceCurrency":"CAD","price":"36.00","priceValidUntil":"2023-03-07","itemCondition":"https://schema.org/NewCondition","availability":"https://schema.org/InStock"},"aggregateRating":{"@type":"AggregateRating","ratingValue":"4.5","reviewCount":"400"},"review":[{"@type":"Review","datePublished":"2023/01/23","name":"Something nice to have for any informal events. That you can pull our every once in a while ","reviewBody":"Something nice to have for any informal events. That you can pull our every once in a while ","reviewRating":{"@type":"Rating","ratingValue":"4","bestRating":"5"},"author":{"@type":"Person","name":"l***3"}},{"@type":"Review","datePublished":"2023/01/14","name":"Looked so so pretty on! Fit pretty snug but I think that was the intended fit and it made my body look amazing! The colour it’s pretty true to the photos on the website too and is really pretty. The buttons seem a little wobbly but they’re definitely secure enough. Overall love it!","reviewBody":"Looked so so pretty on! Fit pretty snug but I think that was the intended fit and it made my body look amazing! The colour it’s pretty true to the photos on the website too and is really pretty. The buttons seem a little wobbly but they’re definitely secure enough. Overall love it!","reviewRating":{"@type":"Rating","ratingValue":"5","bestRating":"5"},"author":{"@type":"Person","name":"c***2"}},{"@type":"Review","datePublished":"2023/01/10","name":"so pretty! it\'s a midi dress but I\'m short so it was down to my ankles which is fine and it fits perfectly! also came earlier than the estimated dates","reviewBody":"so pretty! it\'s a midi dress but I\'m short so it was down to my ankles which is fine and it fits perfectly! also came earlier than the estimated dates","reviewRating":{"@type":"Rating","ratingValue":"5","bestRating":"5"},"author":{"@type":"Person","name":"c***s"}},{"@type":"Review","datePublished":"2023/01/04","name":"i was a bit skeptical when getting this as ive never owned a cowlick dress let alone one of a similar material as this which is thin but very comfortable and is not see through. i was unsure of how the breast part of it was supposed to sit but besides that i love that its sexy yet classy in a way since it exposes a lot up top, (cant say much about cleavage because i dont have much myself) and the slit in the side adds to show off some leg. i love the length because i know i can move around freely and sit down without any problems. really is a beautiful dress and cant wait for a chance to use it again :))","reviewBody":"i was a bit skeptical when getting this as ive never owned a cowlick dress let alone one of a similar material as this which is thin but very comfortable and is not see through. i was unsure of how the breast part of it was supposed to sit but besides that i love that its sexy yet classy in a way since it exposes a lot up top, (cant say much about cleavage because i dont have much myself) and the slit in the side adds to show off some leg. i love the length because i know i can move around freely and sit down without any problems. really is a beautiful dress and cant wait for a chance to use it again :))","reviewRating":{"@type":"Rating","ratingValue":"5","bestRating":"5"},"author":{"@type":"Person","name":"t***a"}},{"@type":"Review","datePublished":"2022/12/31","name":"10/10 - I ordered a medium","reviewBody":"10/10 - I ordered a medium","reviewRating":{"@type":"Rating","ratingValue":"5","bestRating":"5"},"author":{"@type":"Person","name":"C***e"}},{"@type":"Review","datePublished":"2022/12/26","name":"","reviewBody":"","reviewRating":{"@type":"Rating","ratingValue":"5","bestRating":"5"},"author":{"@type":"Person","name":"m***a"}},{"@type":"Review","datePublished":"2022/12/23","name":"It is so cute!! It fits really well, and you can adjust the top!","reviewBody":"It is so cute!! It fits really well, and you can adjust the top!","reviewRating":{"@type":"Rating","ratingValue":"5","bestRating":"5"},"author":{"@type":"Person","name":"r***6"}},{"@type":"Review","datePublished":"2022/12/17","name":"GORGEOUS. Needs an iron before I wear it but it fits wonderfully and though it hugs my belly, I think it’s hot and very flattering","reviewBody":"GORGEOUS. Needs an iron before I wear it but it fits wonderfully and though it hugs my belly, I think it’s hot and very flattering","reviewRating":{"@type":"Rating","ratingValue":"5","bestRating":"5"},"author":{"@type":"Person","name":"m***t"}},{"@type":"Review","datePublished":"2022/12/13","name":"Gorgeous dress, soft satin material, maybe slightly tight on the tummy but it’s a good sizing! Excellent for the price too. Im 5”8 and the dress is a good length, hitting on my calves, good invisible zip and I love a cowl neck dress! Thinking of getting the shorter version as I love this dress so much ","reviewBody":"Gorgeous dress, soft satin material, maybe slightly tight on the tummy but it’s a good sizing! Excellent for the price too. Im 5”8 and the dress is a good length, hitting on my calves, good invisible zip and I love a cowl neck dress! Thinking of getting the shorter version as I love this dress so much ","reviewRating":{"@type":"Rating","ratingValue":"5","bestRating":"5"},"author":{"@type":"Person","name":"c***y"}},{"@type":"Review","datePublished":"2022/12/10","name":"Got this for a wedding, the best dress. Don’t think twice. Get it!!","reviewBody":"Got this for a wedding, the best dress. Don’t think twice. Get it!!","reviewRating":{"@type":"Rating","ratingValue":"5","bestRating":"5"},"author":{"@type":"Person","name":"n***9"
"@context":"https://schema.org/","@type":"Product","name":"Solid Knitted Cami Split Midi Dress & Crop Top","image":["https://img1.shopcider.com/product/1665232506000-ERijTw.jpg"],"url":"https://www.shopcider.com/goods/solid-knitted-cami-split-midi-dress-crop-top","description":"Solid Knitted Cami Split Midi Dress & Crop Top","sku":"CD20220921182068KD","brand":{"@type":"Brand","name":"Cider"},"offers":{"@type":"Offer","url":"https://www.shopcider.com/goods/solid-knitted-cami-split-midi-dress-crop-top","priceCurrency":"CAD","price":"49.00","priceValidUntil":"2023-03-07","itemCondition":"https://schema.org/NewCondition","availability":"https://schema.org/InStock"},"aggregateRating":{"@type":"AggregateRating","ratingValue":"4.8","reviewCount":"274"},"review":[{"@type":"Review","datePublished":"2023/01/20","name":"I really like it . ","reviewBody":"I really like it . ","reviewRating":{"@type":"Rating","ratingValue":"5","bestRating":"5"},"author":{"@type":"Person","name":"m***0"}},{"@type":"Review","datePublished":"2023/01/13","name":"100/10 Read reviews and for real this one is so so amazing!! A catch! I SO MUCH LOVE IT! 😍 deserve","reviewBody":"100/10 Read reviews and for real this one is so so amazing!! A catch! I SO MUCH LOVE IT! 😍 deserve","reviewRating":{"@type":"Rating","ratingValue":"5","bestRating":"5"},"author":{"@type":"Person","name":"m***4"}},{"@type":"Review","datePublished":"2023/01/10","name":"I ordered this for my 15th birthday. I’m absolutely in love. I turn 15 in a week. I ordered it on New Year’s Eve night. I got a size extra small, my bust size is a 32B, my waist is 22 1/2 inches. but I’m also 5’0 and have a butt so I was a little scared but the length is perfect and it’s squat proof super thick material. I don’t usually wear dresses but I absolutely love this one.","reviewBody":"I ordered this for my 15th birthday. I’m absolutely in love. I turn 15 in a week. I ordered it on New Year’s Eve night. I got a size extra small, my bust size is a 32B, my waist is 22 1/2 inches. but I’m also 5’0 and have a butt so I was a little scared but the length is perfect and it’s squat proof super thick material. I don’t usually wear dresses but I absolutely love this one.","reviewRating":{"@type":"Rating","ratingValue":"5","bestRating":"5"},"author":{"@type":"Person","name":"C***K"}},{"@type":"Review","datePublished":"2023/01/07","name":"absolutely adoooore this! the top is a bit weird and puffs up some in the back but the material is so thick and the dress is really well made. be aware that it is extremely form-fitting and the slit is a bit wider than i thought it would be. but overall it\'s stunning!","reviewBody":"absolutely adoooore this! the top is a bit weird and puffs up some in the back but the material is so thick and the dress is really well made. be aware that it is extremely form-fitting and the slit is a bit wider than i thought it would be. but overall it\'s stunning!","reviewRating":{"@type":"Rating","ratingValue":"5","bestRating":"5"},"author":{"@type":"Person","name":"e***u"}},{"@type":"Review","datePublished":"2023/01/07","name":"I love it,fits perfectly, good material soft and warm))) 😻😻😻","reviewBody":"I love it,fits perfectly, good material soft and warm))) 😻😻😻","reviewRating":{"@type":"Rating","ratingValue":"5","bestRating":"5"},"author":{"@type":"Person","name":"e***a"}},{"@type":"Review","datePublished":"2023/01/05","name":"Cute but overated ","reviewBody":"Cute but overated ","reviewRating":{"@type":"Rating","ratingValue":"5","bestRating":"5"},"author":{"@type":"Person","name":"m***6"}},{"@type":"Review","datePublished":"2023/01/04","name":"Nice dress. To my surprise, It’s really really soft and warm. Not itchy at all. I’m 5’4” and around 135 pounds and I normally wear a medium in tops and size 4-6 in jeans. Size medium fit me well. The only thing that’s a little annoying is that the sleeves hang off my shoulders when I move my arms, so I’m thinking of sewing snaps or buttons on to hold it in place. ","reviewBody":"Nice dress. To my surprise, It’s really really soft and warm. Not itchy at all. I’m 5’4” and around 135 pounds and I normally wear a medium in tops and size 4-6 in jeans. Size medium fit me well. The only thing that’s a little annoying is that the sleeves hang off my shoulders when I move my arms, so I’m thinking of sewing snaps or buttons on to hold it in place. ","reviewRating":{"@type":"Rating","ratingValue":"4","bestRating":"5"},"author":{"@type":"Person","name":"t***s"}},{"@type":"Review","datePublished":"2022/12/30","name":"wonderful material and fit is great, hugs your curves perfectly and super comfortable! the arm piece really completes it! get it girl!!♥️","reviewBody":"wonderful material and fit is great, hugs your curves perfectly and super comfortable! the arm piece really completes it! get it girl!!♥️","reviewRating":{"@type":"Rating","ratingValue":"5","bestRating":"5"},"author":{"@type":"Person","name":"f***a"}},{"@type":"Review","datePublished":"2022/12/30","name":"It’s very forgiving and flattering, I’m a 12-14 and bought a large but could have gotten away with a medium for a tighter look. First non supportive dress I’ve bought that still makes the girls look good, and the straps mean you can wear a bra with it if needed! Really surprised how much I love this dress, the bolero with it is really nice as well and you honestly can wear it multiple ways. I think this is cute enough for my NYE outfit!","reviewBody":"It’s very forgiving and flattering, I’m a 12-14 and bought a large but could have gotten away with a medium for a tighter look. First non supportive dress I’ve bought that still makes the girls look good, and the straps mean you can wear a bra with it if needed! Really surprised how much I love this dress, the bolero with it is really nice as well and you honestly can wear it multiple ways. I think this is cute enough for my NYE outfit!","reviewRating":{"@type":"Rating","ratingValue":"5","bestRating":"5"},"author":{"@type":"Person","name":"2***e"}},{"@type":"Review","datePublished":"2022/12/29","name":"Really good quality and compliments my body shape so well! Material is really stretchy so it fits so nicely!! Also it’s really warm so perfect for winter! <33","reviewBody":"Really good quality and compliments my body shape so well! Material is really stretchy so it fits so nicely!! Also it’s really warm so perfect for winter! <33","reviewRating":{"@type":"Rating","ratingValue":"5","bestRating":"5"},"author":{"@type":"Person","name":"e***e"
