"@context":"https://schema.org/","@type":"Product","name":"Patchwork Knit Ripped Midi Dress","image":["https://img1.shopcider.com/product/1657336911000-QkRsfR.jpg"],"url":"https://www.shopcider.com/goods/patchwork-knit-ripped-midi-dress","description":"Patchwork Knit Ripped Midi Dress","sku":"CD20220520104275KD","brand":{"@type":"Brand","name":"Cider"},"offers":{"@type":"Offer","url":"https://www.shopcider.com/goods/patchwork-knit-ripped-midi-dress","priceCurrency":"CAD","price":"36.00","priceValidUntil":"2023-03-07","itemCondition":"https://schema.org/NewCondition","availability":"https://schema.org/InStock"},"aggregateRating":{"@type":"AggregateRating","ratingValue":"4.7","reviewCount":"198"},"review":[{"@type":"Review","datePublished":"2022/12/04","name":"Birthday fit yesterday.I bought this one not knowing exactly how I wear it but it was perfect and I got so many compliments.@lexington35#7408","reviewBody":"Birthday fit yesterday.I bought this one not knowing exactly how I wear it but it was perfect and I got so many compliments.@lexington35#7408","reviewRating":{"@type":"Rating","ratingValue":"5","bestRating":"5"},"author":{"@type":"Person","name":"Cider Gang"}},{"@type":"Review","datePublished":"2022/12/23","name":"Love it. A bit flimsy but to be expected with the distressed style, I should have gone for the size smaller but that’s my own error ","reviewBody":"Love it. A bit flimsy but to be expected with the distressed style, I should have gone for the size smaller but that’s my own error ","reviewRating":{"@type":"Rating","ratingValue":"5","bestRating":"5"},"author":{"@type":"Person","name":"s***t"}},{"@type":"Review","datePublished":"2022/12/22","name":"Love this dress wear it all the time with all black underneath and it looks great! Might get in other colours :)","reviewBody":"Love this dress wear it all the time with all black underneath and it looks great! Might get in other colours :)","reviewRating":{"@type":"Rating","ratingValue":"5","bestRating":"5"},"author":{"@type":"Person","name":"D***r"}},{"@type":"Review","datePublished":"2022/12/17","name":"I love that 🫠🥵","reviewBody":"I love that 🫠🥵","reviewRating":{"@type":"Rating","ratingValue":"5","bestRating":"5"},"author":{"@type":"Person","name":"j***4"}},{"@type":"Review","datePublished":"2022/12/15","name":"great.wow so pretty. but too long for me.\\nI think it will looks good for 2m women.\\nor like a fashion model.  hahahahahahahahahhahah  But ita\'s great. It\'s colour also nice. wow so pretty. but too long for me.\\nI think it will looks good for 2m women.\\nor like a fashion model.  hahahahahahahahahhahah  But ita\'s great. It\'s colour also nice. I will order again,not rhis on. maybe like a dress.","reviewBody":"great.wow so pretty. but too long for me.\\nI think it will looks good for 2m women.\\nor like a fashion model.  hahahahahahahahahhahah  But ita\'s great. It\'s colour also nice. wow so pretty. but too long for me.\\nI think it will looks good for 2m women.\\nor like a fashion model.  hahahahahahahahahhahah  But ita\'s great. It\'s colour also nice. I will order again,not rhis on. maybe like a dress.","reviewRating":{"@type":"Rating","ratingValue":"5","bestRating":"5"},"author":{"@type":"Person","name":"b***3"}},{"@type":"Review","datePublished":"2022/12/13","name":"I’m a size 36DD and 10-14 in pants. This dress made me feel so confident and curvy! I’m glad I added it to my cart last minute. ","reviewBody":"I’m a size 36DD and 10-14 in pants. This dress made me feel so confident and curvy! I’m glad I added it to my cart last minute. ","reviewRating":{"@type":"Rating","ratingValue":"5","bestRating":"5"},"author":{"@type":"Person","name":"7***h"}},{"@type":"Review","datePublished":"2022/12/07","name":"Definitely one of my favorite pieces. 🤍","reviewBody":"Definitely one of my favorite pieces. 🤍","reviewRating":{"@type":"Rating","ratingValue":"5","bestRating":"5"},"author":{"@type":"Person","name":"e***8"}},{"@type":"Review","datePublished":"2022/12/04","name":"Love the dress lovely material and super comfy true to size ","reviewBody":"Love the dress lovely material and super comfy true to size ","reviewRating":{"@type":"Rating","ratingValue":"5","bestRating":"5"},"author":{"@type":"Person","name":"c***n"}},{"@type":"Review","datePublished":"2022/12/04","name":"This dress REALLY PRETTY!!!!\\nI love it so much !!!!! it too big for me but still beautiful \\nI wish this color will have XS size back in stock and I\'ll order it again \\nHeight : 155 cm Weight : 53 kg\\nWaist : 26-26.5 inches Hip : 37 inches","reviewBody":"This dress REALLY PRETTY!!!!\\nI love it so much !!!!! it too big for me but still beautiful \\nI wish this color will have XS size back in stock and I\'ll order it again \\nHeight : 155 cm Weight : 53 kg\\nWaist : 26-26.5 inches Hip : 37 inches","reviewRating":{"@type":"Rating","ratingValue":"5","bestRating":"5"},"author":{"@type":"Person","name":"b***a"}},{"@type":"Review","datePublished":"2022/12/04","name":"A bit small for xl I’m 6 foot and the dress comes a little under my knees but it’s so cute and my bf said I looked like a 1920s waif so I’m keeping it lol It’s amazing quality this was my first time ordering from cider and I’m pretty impressed with my order. Thanks cider hugs and kisses will look cute with my demonias girlllllllls","reviewBody":"A bit small for xl I’m 6 foot and the dress comes a little under my knees but it’s so cute and my bf said I looked like a 1920s waif so I’m keeping it lol It’s amazing quality this was my first time ordering from cider and I’m pretty impressed with my order. Thanks cider hugs and kisses will look cute with my demonias girlllllllls","reviewRating":{"@type":"Rating","ratingValue":"4","bestRating":"5"},"author":{"@type":"Person","name":"L***m"
"@context":"https://schema.org/","@type":"Product","name":"Solid V-neck Knitted Midi Dress","image":["https://img1.shopcider.com/product/1661499028000-3S6KnS.jpg"],"url":"https://www.shopcider.com/goods/solid-knitted-midi-dress","description":"Solid V-neck Knitted Midi Dress","sku":"CD20220808153859KD","brand":{"@type":"Brand","name":"Cider"},"offers":{"@type":"Offer","url":"https://www.shopcider.com/goods/solid-knitted-midi-dress","priceCurrency":"CAD","price":"49.00","priceValidUntil":"2023-03-07","itemCondition":"https://schema.org/NewCondition","availability":"https://schema.org/InStock"},"aggregateRating":{"@type":"AggregateRating","ratingValue":"4.8","reviewCount":"55"},"review":[{"@type":"Review","datePublished":"2023/01/12","name":"Love this ❤️ Feels so comfy and the colour is beautiful. it fits nicely too. very flattering shape 😍\\ndon\'t have any full body pictures, sorry!","reviewBody":"Love this ❤️ Feels so comfy and the colour is beautiful. it fits nicely too. very flattering shape 😍\\ndon\'t have any full body pictures, sorry!","reviewRating":{"@type":"Rating","ratingValue":"5","bestRating":"5"},"author":{"@type":"Person","name":"c***r"}},{"@type":"Review","datePublished":"2023/01/06","name":"This dress is stunning! I love all of it: the color,  the texture, tha fabric. I\'m 197 pounds and 5\'4\\" and fits me perfectly ","reviewBody":"This dress is stunning! I love all of it: the color,  the texture, tha fabric. I\'m 197 pounds and 5\'4\\" and fits me perfectly ","reviewRating":{"@type":"Rating","ratingValue":"5","bestRating":"5"},"author":{"@type":"Person","name":"p***o"}},{"@type":"Review","datePublished":"2022/12/16","name":"Honestly, order a couple sizes down or maybe order the size of your smallest measurement, I was recommended an xl but felt it was too large so I got a large even tho I felt I needed a medium… which I did. This dress quality is nice it’s think and it’s beautiful however it’s large and not giving when I thought it would give I’m happy with it but it makes me a bit sad","reviewBody":"Honestly, order a couple sizes down or maybe order the size of your smallest measurement, I was recommended an xl but felt it was too large so I got a large even tho I felt I needed a medium… which I did. This dress quality is nice it’s think and it’s beautiful however it’s large and not giving when I thought it would give I’m happy with it but it makes me a bit sad","reviewRating":{"@type":"Rating","ratingValue":"2","bestRating":"5"},"author":{"@type":"Person","name":"a***9"}},{"@type":"Review","datePublished":"2022/12/07","name":"Love it fits perfectly. Hugs the body well. Would like to purchase in another color.","reviewBody":"Love it fits perfectly. Hugs the body well. Would like to purchase in another color.","reviewRating":{"@type":"Rating","ratingValue":"5","bestRating":"5"},"author":{"@type":"Person","name":"b***3"}},{"@type":"Review","datePublished":"2022/12/06","name":"So cute! You can place it off the shoulder or on. \\n\\nSize XS","reviewBody":"So cute! You can place it off the shoulder or on. \\n\\nSize XS","reviewRating":{"@type":"Rating","ratingValue":"5","bestRating":"5"},"author":{"@type":"Person","name":"p***y"}},{"@type":"Review","datePublished":"2022/11/29","name":"Loved this dress. I typically wear size 14 and the XL fit perfectly! I was pleasantly surprised and impressed with the quality of the fabric ","reviewBody":"Loved this dress. I typically wear size 14 and the XL fit perfectly! I was pleasantly surprised and impressed with the quality of the fabric ","reviewRating":{"@type":"Rating","ratingValue":"5","bestRating":"5"},"author":{"@type":"Person","name":"b***y"}},{"@type":"Review","datePublished":"2022/11/23","name":"I absolutely love this dress. It fits so well and the color is lovely. The material is really thick and soft.","reviewBody":"I absolutely love this dress. It fits so well and the color is lovely. The material is really thick and soft.","reviewRating":{"@type":"Rating","ratingValue":"5","bestRating":"5"},"author":{"@type":"Person","name":"k***e"}},{"@type":"Review","datePublished":"2022/11/18","name":"Definitely size down as material is super stretchy, lovely colour ","reviewBody":"Definitely size down as material is super stretchy, lovely colour ","reviewRating":{"@type":"Rating","ratingValue":"4","bestRating":"5"},"author":{"@type":"Person","name":"a***a"}},{"@type":"Review","datePublished":"2023/02/06","name":"beautiful very comfy ","reviewBody":"beautiful very comfy ","reviewRating":{"@type":"Rating","ratingValue":"5","bestRating":"5"},"author":{"@type":"Person","name":"s***9"}},{"@type":"Review","datePublished":"2023/01/26","name":"This is so beautiful I didn’t want to take it off❤️","reviewBody":"This is so beautiful I didn’t want to take it off❤️","reviewRating":{"@type":"Rating","ratingValue":"5","bestRating":"5"},"author":{"@type":"Person","name":"g***s"
"@context":"https://schema.org/","@type":"Product","name":"Solid Satin Cowl Neck Cami Mini Dress","image":["https://img1.shopcider.com/product/1663555437000-TwaWpm.jpg"],"url":"https://www.shopcider.com/goods/solid-satin-sweetheart-cami-mini-dress","description":"Solid Satin Cowl Neck Cami Mini Dress","sku":"CD20220825165087MD","brand":{"@type":"Brand","name":"Cider"},"offers":{"@type":"Offer","url":"https://www.shopcider.com/goods/solid-satin-sweetheart-cami-mini-dress","priceCurrency":"CAD","price":"25.00","priceValidUntil":"2023-03-07","itemCondition":"https://schema.org/NewCondition","availability":"https://schema.org/InStock"},"aggregateRating":{"@type":"AggregateRating","ratingValue":"4.6","reviewCount":"194"},"review":[{"@type":"Review","datePublished":"02/03/2023","name":"Adorable and fits perfect!","reviewBody":"Adorable and fits perfect!","reviewRating":{"@type":"Rating","ratingValue":"5","bestRating":"5"},"author":{"@type":"Person","name":"k***e"}},{"@type":"Review","datePublished":"02/02/2023","name":"So darn cute! Adjustable straps. I’m a small and it fits perfect.","reviewBody":"So darn cute! Adjustable straps. I’m a small and it fits perfect.","reviewRating":{"@type":"Rating","ratingValue":"5","bestRating":"5"},"author":{"@type":"Person","name":"k***e"}},{"@type":"Review","datePublished":"01/29/2023","name":"cute motel rocks dupe ","reviewBody":"cute motel rocks dupe ","reviewRating":{"@type":"Rating","ratingValue":"5","bestRating":"5"},"author":{"@type":"Person","name":"i***e"}},{"@type":"Review","datePublished":"01/12/2023","name":"Order a size down, its cute, the neck goes pretty high. Cute though ","reviewBody":"Order a size down, its cute, the neck goes pretty high. Cute though ","reviewRating":{"@type":"Rating","ratingValue":"4","bestRating":"5"},"author":{"@type":"Person","name":"C***L"}},{"@type":"Review","datePublished":"01/10/2023","name":"it is absolutely amazing! I recommend buying a size above like i did because it can run small but it is kinda stretchy ","reviewBody":"it is absolutely amazing! I recommend buying a size above like i did because it can run small but it is kinda stretchy ","reviewRating":{"@type":"Rating","ratingValue":"5","bestRating":"5"},"author":{"@type":"Person","name":"d***r"}},{"@type":"Review","datePublished":"01/26/2023","name":"This dress was gorgeous after a few front adjustments. Even if you do buy a size too big the adjustable strings make it fit so well. Very good material was at a comfortable length. Definitely use the rubber band and safety pin hack to make the front more fitted. Very good for price, perfect for night out. ","reviewBody":"This dress was gorgeous after a few front adjustments. Even if you do buy a size too big the adjustable strings make it fit so well. Very good material was at a comfortable length. Definitely use the rubber band and safety pin hack to make the front more fitted. Very good for price, perfect for night out. ","reviewRating":{"@type":"Rating","ratingValue":"5","bestRating":"5"},"author":{"@type":"Person","name":"p***n"}},{"@type":"Review","datePublished":"01/23/2023","name":"Incredible how good fit on me really my favorite dress. The material is fresh and smooth, buy it.","reviewBody":"Incredible how good fit on me really my favorite dress. The material is fresh and smooth, buy it.","reviewRating":{"@type":"Rating","ratingValue":"5","bestRating":"5"},"author":{"@type":"Person","name":"M***?"}},{"@type":"Review","datePublished":"01/13/2023","name":"received item in good condition!! love the material","reviewBody":"received item in good condition!! love the material","reviewRating":{"@type":"Rating","ratingValue":"5","bestRating":"5"},"author":{"@type":"Person","name":"y***0"}},{"@type":"Review","datePublished":"01/11/2023","name":"É lindo, de boa qualidade e muito fofo!! Só queria que fosse mais pequeno. nznxbhsjsnsmmnz","reviewBody":"É lindo, de boa qualidade e muito fofo!! Só queria que fosse mais pequeno. nznxbhsjsnsmmnz","reviewRating":{"@type":"Rating","ratingValue":"5","bestRating":"5"},"author":{"@type":"Person","name":"f***a"}},{"@type":"Review","datePublished":"01/11/2023","name":"Soo pretty, the quality is pretty good too. It shows off the figure really well and isn’t too short. Im really happy with this dress❤️","reviewBody":"Soo pretty, the quality is pretty good too. It shows off the figure really well and isn’t too short. Im really happy with this dress❤️","reviewRating":{"@type":"Rating","ratingValue":"5","bestRating":"5"},"author":{"@type":"Person","name":"l***e"
"@context":"https://schema.org/","@type":"Product","name":"Rib Button Drawstring Midi Dress ","image":["https://img1.shopcider.com/product/1654486464000-4yT7RZ.jpg"],"url":"https://www.shopcider.com/goods/rib-button-drawstring-midi-dress","description":"Rib Button Drawstring Midi Dress ","sku":"CD2022042793347MD","brand":{"@type":"Brand","name":"Cider"},"offers":{"@type":"Offer","url":"https://www.shopcider.com/goods/rib-button-drawstring-midi-dress","priceCurrency":"CAD","price":"36.00","priceValidUntil":"2023-03-07","itemCondition":"https://schema.org/NewCondition","availability":"https://schema.org/InStock"},"aggregateRating":{"@type":"AggregateRating","ratingValue":"4.9","reviewCount":"245"},"review":[{"@type":"Review","datePublished":"2023/01/18","name":"I love this😍 my height is 157sm, my weight is 70kq. It is quite stretchy. I will definitely get the other colours 😍","reviewBody":"I love this😍 my height is 157sm, my weight is 70kq. It is quite stretchy. I will definitely get the other colours 😍","reviewRating":{"@type":"Rating","ratingValue":"5","bestRating":"5"},"author":{"@type":"Person","name":"a***a"}},{"@type":"Review","datePublished":"2022/12/02","name":"I love the fit, nice details and nice material. Very comfortable. Ordered xs. ","reviewBody":"I love the fit, nice details and nice material. Very comfortable. Ordered xs. ","reviewRating":{"@type":"Rating","ratingValue":"5","bestRating":"5"},"author":{"@type":"Person","name":"e***n"}},{"@type":"Review","datePublished":"2022/11/27","name":"Love these dresses with the strings to adjust the ruching on the dress. For the price I thought it was decent material and construction. I feel really sexy when I wear it. Wore it dancing and it was perfect - no tearing or discomfort. \\n\\nI do wear shape wear and 34DD push up bra under it.  \\n","reviewBody":"Love these dresses with the strings to adjust the ruching on the dress. For the price I thought it was decent material and construction. I feel really sexy when I wear it. Wore it dancing and it was perfect - no tearing or discomfort. \\n\\nI do wear shape wear and 34DD push up bra under it.  \\n","reviewRating":{"@type":"Rating","ratingValue":"5","bestRating":"5"},"author":{"@type":"Person","name":"k***0"}},{"@type":"Review","datePublished":"2022/11/26","name":"Fits like a glove! I love the color and texture of this dress! ","reviewBody":"Fits like a glove! I love the color and texture of this dress! ","reviewRating":{"@type":"Rating","ratingValue":"5","bestRating":"5"},"author":{"@type":"Person","name":"l***5"}},{"@type":"Review","datePublished":"2022/11/08","name":"Love it!!! Just as pictured and fit so well. It’s very stretchy and the material is great. Definitely recommend!","reviewBody":"Love it!!! Just as pictured and fit so well. It’s very stretchy and the material is great. Definitely recommend!","reviewRating":{"@type":"Rating","ratingValue":"5","bestRating":"5"},"author":{"@type":"Person","name":"d***1"}},{"@type":"Review","datePublished":"2022/11/07","name":"My new favorite dress! So easy to dress up or dress down! Love the color and material ","reviewBody":"My new favorite dress! So easy to dress up or dress down! Love the color and material ","reviewRating":{"@type":"Rating","ratingValue":"5","bestRating":"5"},"author":{"@type":"Person","name":"s***r"}},{"@type":"Review","datePublished":"2022/10/29","name":"If you want to look snatched, get this dress immediately. It is very true to size and the fabric is very good for summer and i would recommend it for an go to every day look with a red bag and red shoes or any other form of color blocking. This dress really compliments your body.","reviewBody":"If you want to look snatched, get this dress immediately. It is very true to size and the fabric is very good for summer and i would recommend it for an go to every day look with a red bag and red shoes or any other form of color blocking. This dress really compliments your body.","reviewRating":{"@type":"Rating","ratingValue":"5","bestRating":"5"},"author":{"@type":"Person","name":"m***y"}},{"@type":"Review","datePublished":"2022/10/21","name":"Amazing dress, fits like a glove and makes me feel so confident, the fabric is warm and stretchy. It is easy to clean and care for. It is perfect for a night out or even a day in the park. Definitely for summer garment than winter. It came on time and true to its size and appearance. ","reviewBody":"Amazing dress, fits like a glove and makes me feel so confident, the fabric is warm and stretchy. It is easy to clean and care for. It is perfect for a night out or even a day in the park. Definitely for summer garment than winter. It came on time and true to its size and appearance. ","reviewRating":{"@type":"Rating","ratingValue":"5","bestRating":"5"},"author":{"@type":"Person","name":"m***n"}},{"@type":"Review","datePublished":"2022/09/30","name":"Loved it! It’s so nice and comfortable!","reviewBody":"Loved it! It’s so nice and comfortable!","reviewRating":{"@type":"Rating","ratingValue":"5","bestRating":"5"},"author":{"@type":"Person","name":"c***5"}},{"@type":"Review","datePublished":"2022/09/28","name":"I’m 5’10 (125) the dress fits very nicely, the only issue i have with the dress is that the slit runs up a little high but it’s a gorgeous fit. ","reviewBody":"I’m 5’10 (125) the dress fits very nicely, the only issue i have with the dress is that the slit runs up a little high but it’s a gorgeous fit. ","reviewRating":{"@type":"Rating","ratingValue":"4","bestRating":"5"},"author":{"@type":"Person","name":"g***y"
