"@context":"https://schema.org/","@type":"Product","name":"Curve & Plus Houndstooth Square Neck Button Up Mini Dress","image":["https://img1.shopcider.com/product/1670551647000-H38dtw.jpg"],"url":"https://www.shopcider.com/goods/curve-plus-houndstooth-square-neck-button-up-mini-dress","description":"Curve & Plus Houndstooth Square Neck Button Up Mini Dress","sku":"CD20221110206094DR","brand":{"@type":"Brand","name":"Cider"},"offers":{"@type":"Offer","url":"https://www.shopcider.com/goods/curve-plus-houndstooth-square-neck-button-up-mini-dress","priceCurrency":"CAD","price":"33.00","priceValidUntil":"2023-03-07","itemCondition":"https://schema.org/NewCondition","availability":"https://schema.org/InStock"},"aggregateRating":{"@type":"AggregateRating","ratingValue":"4.3","reviewCount":"34"},"review":[{"@type":"Review","datePublished":"2023/01/10","name":"cute but a little too big! i dont have enough boobs! hihi, but cute! ","reviewBody":"cute but a little too big! i dont have enough boobs! hihi, but cute! ","reviewRating":{"@type":"Rating","ratingValue":"4","bestRating":"5"},"author":{"@type":"Person","name":"g***u"}},{"@type":"Review","datePublished":"2023/01/05","name":"Doesn’t cinch in at the waist like I would like it to/like it does in the listing photo. The fabric is lighter weight than I expected but since it’s meant to be layered I don’t mind. I’ve got more room in the dress than I thought I would, but again, since it’s meant to be layered on top of other items (like tights and a turtleneck), that’s ok. I think I’ll like it better once it’s layered with other items. The buttons ARE real, so it can be fully unbuttoned, which I did not expect.","reviewBody":"Doesn’t cinch in at the waist like I would like it to/like it does in the listing photo. The fabric is lighter weight than I expected but since it’s meant to be layered I don’t mind. I’ve got more room in the dress than I thought I would, but again, since it’s meant to be layered on top of other items (like tights and a turtleneck), that’s ok. I think I’ll like it better once it’s layered with other items. The buttons ARE real, so it can be fully unbuttoned, which I did not expect.","reviewRating":{"@type":"Rating","ratingValue":"4","bestRating":"5"},"author":{"@type":"Person","name":"e***5"}},{"@type":"Review","datePublished":"2023/01/21","name":"A little too short but can work with something on your legs underneath ","reviewBody":"A little too short but can work with something on your legs underneath ","reviewRating":{"@type":"Rating","ratingValue":"3","bestRating":"5"},"author":{"@type":"Person","name":"b***n"}},{"@type":"Review","datePublished":"2023/01/21","name":"no give to the fabric but so adorable","reviewBody":"no give to the fabric but so adorable","reviewRating":{"@type":"Rating","ratingValue":"3","bestRating":"5"},"author":{"@type":"Person","name":"j***6"}},{"@type":"Review","datePublished":"2023/01/21","name":"Love it","reviewBody":"Love it","reviewRating":{"@type":"Rating","ratingValue":"5","bestRating":"5"},"author":{"@type":"Person","name":"k***1"}},{"@type":"Review","datePublished":"2023/01/20","name":"If you’re a pear shape like me, it’s quite big up top. It’s manageable with a thicker sweater underneath. Very cute though, also the material is quite thin so great for layering.","reviewBody":"If you’re a pear shape like me, it’s quite big up top. It’s manageable with a thicker sweater underneath. Very cute though, also the material is quite thin so great for layering.","reviewRating":{"@type":"Rating","ratingValue":"4","bestRating":"5"},"author":{"@type":"Person","name":"d***y"}},{"@type":"Review","datePublished":"2023/01/11","name":"I love this dress its actually pretty light weight which I wasn\'t expecting I thought it was going to be heavy the only thing is the top button is too tight for my chest if you have a large bust maybe size up ","reviewBody":"I love this dress its actually pretty light weight which I wasn\'t expecting I thought it was going to be heavy the only thing is the top button is too tight for my chest if you have a large bust maybe size up ","reviewRating":{"@type":"Rating","ratingValue":"4","bestRating":"5"},"author":{"@type":"Person","name":"l***r"}},{"@type":"Review","datePublished":"2023/01/11","name":"Very cute! A bit big, but i\'m between two sizes 🤷\u200d♀️ the neckline is a bit lower that i wxpected, but still very cute! ","reviewBody":"Very cute! A bit big, but i\'m between two sizes 🤷\u200d♀️ the neckline is a bit lower that i wxpected, but still very cute! ","reviewRating":{"@type":"Rating","ratingValue":"4","bestRating":"5"},"author":{"@type":"Person","name":"h***a"}},{"@type":"Review","datePublished":"2023/01/10","name":"Love this, fits and looks great","reviewBody":"Love this, fits and looks great","reviewRating":{"@type":"Rating","ratingValue":"5","bestRating":"5"},"author":{"@type":"Person","name":"r***3"}},{"@type":"Review","datePublished":"2023/01/07","name":"Having to return as it is too big on the shoulders. Lovely fabric though and was a good length ","reviewBody":"Having to return as it is too big on the shoulders. Lovely fabric though and was a good length ","reviewRating":{"@type":"Rating","ratingValue":"5","bestRating":"5"},"author":{"@type":"Person","name":"w***b"
"@context":"https://schema.org/","@type":"Product","name":"Button Down Corset Shirt Dress","image":["https://img.shopcider.com/hermes/posting/1653891038000-qcjpch.jpg"],"url":"https://www.shopcider.com/goods/button-down-corset-shirt-dress","description":"Button Down Corset Shirt Dress","sku":"CD202011250230DR","brand":{"@type":"Brand","name":"Cider"},"offers":{"@type":"Offer","url":"https://www.shopcider.com/goods/button-down-corset-shirt-dress","priceCurrency":"CAD","price":"33.00","priceValidUntil":"2023-03-07","itemCondition":"https://schema.org/NewCondition","availability":"https://schema.org/InStock"},"aggregateRating":{"@type":"AggregateRating","ratingValue":"4.5","reviewCount":"124"},"review":[{"@type":"Review","datePublished":"2023/01/05","name":"5’10, 144lbs. I opted for the small despite my height, glad I did. It fits perfectly. Not sure if I can safely bend over in this but that’s a tall girl problem with most dresses. Very cute. ","reviewBody":"5’10, 144lbs. I opted for the small despite my height, glad I did. It fits perfectly. Not sure if I can safely bend over in this but that’s a tall girl problem with most dresses. Very cute. ","reviewRating":{"@type":"Rating","ratingValue":"5","bestRating":"5"},"author":{"@type":"Person","name":"r***h"}},{"@type":"Review","datePublished":"2022/12/10","name":"Tight and loose in the right places. The material also has a little stretch, I love it :) ","reviewBody":"Tight and loose in the right places. The material also has a little stretch, I love it :) ","reviewRating":{"@type":"Rating","ratingValue":"5","bestRating":"5"},"author":{"@type":"Person","name":"h***0"}},{"@type":"Review","datePublished":"2022/12/09","name":"The shirt itself is really comfortable and made out of a nice material, it\'s a little see through but not so much that you couldn\'t just wear white underwear and it\'d be fine. It shapes the body really nicely, it just runs a little large across the chest and in the arms so if you\'re going for a fitted look I would size down.","reviewBody":"The shirt itself is really comfortable and made out of a nice material, it\'s a little see through but not so much that you couldn\'t just wear white underwear and it\'d be fine. It shapes the body really nicely, it just runs a little large across the chest and in the arms so if you\'re going for a fitted look I would size down.","reviewRating":{"@type":"Rating","ratingValue":"4","bestRating":"5"},"author":{"@type":"Person","name":"a***s"}},{"@type":"Review","datePublished":"2022/11/27","name":"Amazing shirt dress. I am with the corset. A bit short, so you will need some tight shorts under it.","reviewBody":"Amazing shirt dress. I am with the corset. A bit short, so you will need some tight shorts under it.","reviewRating":{"@type":"Rating","ratingValue":"5","bestRating":"5"},"author":{"@type":"Person","name":"m***a"}},{"@type":"Review","datePublished":"2022/11/27","name":"It’s a little loose but pairs so nicely with other pieces, I almost don’t mind that it’s loose. It’s a bit longer in the back which I really appreciate because my main issues with skirts and short dresses is that my rump often causes the back sides of skirts/dresses to go up and expose my a*s. This dress doesn’t do that so I’m very glad. I like to pair it with the second dress over it and it makes a cute and complete outfit. (Don’t mind the tire in the background lol)","reviewBody":"It’s a little loose but pairs so nicely with other pieces, I almost don’t mind that it’s loose. It’s a bit longer in the back which I really appreciate because my main issues with skirts and short dresses is that my rump often causes the back sides of skirts/dresses to go up and expose my a*s. This dress doesn’t do that so I’m very glad. I like to pair it with the second dress over it and it makes a cute and complete outfit. (Don’t mind the tire in the background lol)","reviewRating":{"@type":"Rating","ratingValue":"5","bestRating":"5"},"author":{"@type":"Person","name":"d***a"}},{"@type":"Review","datePublished":"2022/11/24","name":"Pretty cute! Not my usual style but I\'m trying something new. a little loose, but if I got smaller I\'m afraid it\'d be too short. Came very wrinkly and the pleats need ironing, bummer cause I wanted to wear it ASAP. Wearing it with fishnets and boots and a corset, so far so good! Stitching kinda coming apart. ","reviewBody":"Pretty cute! Not my usual style but I\'m trying something new. a little loose, but if I got smaller I\'m afraid it\'d be too short. Came very wrinkly and the pleats need ironing, bummer cause I wanted to wear it ASAP. Wearing it with fishnets and boots and a corset, so far so good! Stitching kinda coming apart. ","reviewRating":{"@type":"Rating","ratingValue":"4","bestRating":"5"},"author":{"@type":"Person","name":"c***5"}},{"@type":"Review","datePublished":"2022/09/29","name":"Super cute fit is amazing ","reviewBody":"Super cute fit is amazing ","reviewRating":{"@type":"Rating","ratingValue":"5","bestRating":"5"},"author":{"@type":"Person","name":"s***l"}},{"@type":"Review","datePublished":"2022/08/11","name":"got in a size xl I\'m 5\'4\\",260lbs, and fits pretty nice, very loose on arms and shoulders, but skin tight on waist,","reviewBody":"got in a size xl I\'m 5\'4\\",260lbs, and fits pretty nice, very loose on arms and shoulders, but skin tight on waist,","reviewRating":{"@type":"Rating","ratingValue":"4","bestRating":"5"},"author":{"@type":"Person","name":"w***l"}},{"@type":"Review","datePublished":"2022/08/03","name":"It looks cute, but for sure must order size below your usual size ","reviewBody":"It looks cute, but for sure must order size below your usual size ","reviewRating":{"@type":"Rating","ratingValue":"5","bestRating":"5"},"author":{"@type":"Person","name":"6***y"}},{"@type":"Review","datePublished":"2022/05/31","name":"Cute ❤️","reviewBody":"Cute ❤️","reviewRating":{"@type":"Rating","ratingValue":"5","bestRating":"5"},"author":{"@type":"Person","name":"t***7"
"@context":"https://schema.org/","@type":"Product","name":"Mesh Puff Sleeve Mini Dress","image":["https://img1.shopcider.com/product/1655893358000-Mh8snN.jpg"],"url":"https://www.shopcider.com/goods/mesh-puff-sleeve-mini-dress-11","description":"Mesh Puff Sleeve Mini Dress","sku":"CD2022042088855MD","brand":{"@type":"Brand","name":"Cider"},"offers":{"@type":"Offer","url":"https://www.shopcider.com/goods/mesh-puff-sleeve-mini-dress-11","priceCurrency":"CAD","price":"36.00","priceValidUntil":"2023-03-07","itemCondition":"https://schema.org/NewCondition","availability":"https://schema.org/InStock"},"aggregateRating":{"@type":"AggregateRating","ratingValue":"4.8","reviewCount":"200"},"review":[{"@type":"Review","datePublished":"2023/01/23","name":"Super cute just a bit short on length ","reviewBody":"Super cute just a bit short on length ","reviewRating":{"@type":"Rating","ratingValue":"5","bestRating":"5"},"author":{"@type":"Person","name":"d***7"}},{"@type":"Review","datePublished":"2023/01/05","name":"honestly my favorite dress ever. it hugs so well while still having a flow !!! it can easily be dressed up or down <3 ive worn this dress just for the ordinary day and i get so many compliments. IT FITS ALL BODY TYPES i have a pretty large bust and you can pull this dress up a bit to accommodate for that ","reviewBody":"honestly my favorite dress ever. it hugs so well while still having a flow !!! it can easily be dressed up or down <3 ive worn this dress just for the ordinary day and i get so many compliments. IT FITS ALL BODY TYPES i have a pretty large bust and you can pull this dress up a bit to accommodate for that ","reviewRating":{"@type":"Rating","ratingValue":"5","bestRating":"5"},"author":{"@type":"Person","name":"m***n"}},{"@type":"Review","datePublished":"2022/12/27","name":"Really cute! Really good length, not too long not too short. I find the arms a LITTLE uncomfortable, idk why but it’s slightly itchy, that might just be me tho💀😭, nevertheless the less a really good purchase, would recommend🤌🏽\\n\\nHeight: 165cm Weight: 158lbs","reviewBody":"Really cute! Really good length, not too long not too short. I find the arms a LITTLE uncomfortable, idk why but it’s slightly itchy, that might just be me tho💀😭, nevertheless the less a really good purchase, would recommend🤌🏽\\n\\nHeight: 165cm Weight: 158lbs","reviewRating":{"@type":"Rating","ratingValue":"4","bestRating":"5"},"author":{"@type":"Person","name":"s***o"}},{"@type":"Review","datePublished":"2022/12/24","name":"very nice","reviewBody":"very nice","reviewRating":{"@type":"Rating","ratingValue":"4","bestRating":"5"},"author":{"@type":"Person","name":"k***8"}},{"@type":"Review","datePublished":"2022/12/16","name":"i absolutely love it, exactly like the picture if not better","reviewBody":"i absolutely love it, exactly like the picture if not better","reviewRating":{"@type":"Rating","ratingValue":"5","bestRating":"5"},"author":{"@type":"Person","name":"a***2"}},{"@type":"Review","datePublished":"2022/12/15","name":"So cute, one of my favorite dresses now! Fit perfectly and quality is pretty good, looks even better in person than in the photos. I’m 5’1 and the dress is a great length! ","reviewBody":"So cute, one of my favorite dresses now! Fit perfectly and quality is pretty good, looks even better in person than in the photos. I’m 5’1 and the dress is a great length! ","reviewRating":{"@type":"Rating","ratingValue":"5","bestRating":"5"},"author":{"@type":"Person","name":"o***y"}},{"@type":"Review","datePublished":"2022/12/14","name":"Wore this the first time to see Hamilton in NYC and it fit amazingly and was super comfortable. I got a lot of compliments and I felt so pretty wearing it. Would totes recommend. B) ","reviewBody":"Wore this the first time to see Hamilton in NYC and it fit amazingly and was super comfortable. I got a lot of compliments and I felt so pretty wearing it. Would totes recommend. B) ","reviewRating":{"@type":"Rating","ratingValue":"5","bestRating":"5"},"author":{"@type":"Person","name":"s***v"}},{"@type":"Review","datePublished":"2022/12/13","name":"Super cute dress, very comfortable and stretchy. A tiny bit short in the back but not too bad. ","reviewBody":"Super cute dress, very comfortable and stretchy. A tiny bit short in the back but not too bad. ","reviewRating":{"@type":"Rating","ratingValue":"5","bestRating":"5"},"author":{"@type":"Person","name":"h***s"}},{"@type":"Review","datePublished":"2022/12/06","name":"This item is really cute! It looks similar to a night gown but for outside of that makes sense. I have some really cute Combat boots that will look good with it😊 \\n\\nI would pair some spandex or something underneath the dress tho. ","reviewBody":"This item is really cute! It looks similar to a night gown but for outside of that makes sense. I have some really cute Combat boots that will look good with it😊 \\n\\nI would pair some spandex or something underneath the dress tho. ","reviewRating":{"@type":"Rating","ratingValue":"5","bestRating":"5"},"author":{"@type":"Person","name":"j***8"}},{"@type":"Review","datePublished":"2022/11/26","name":"really cute, fits perfectly (I bought XL) My height is 1.59 mts.","reviewBody":"really cute, fits perfectly (I bought XL) My height is 1.59 mts.","reviewRating":{"@type":"Rating","ratingValue":"5","bestRating":"5"},"author":{"@type":"Person","name":"s***9"
"@context":"https://schema.org/","@type":"Product","name":"Toile de Jouy Patchy Shirt Dress","image":["https://img1.shopcider.com/product/1655978117000-XxQE3m.jpg"],"url":"https://www.shopcider.com/goods/toile-de-jouy-patchy-shirt-dress","description":"Toile de Jouy Patchy Shirt Dress","sku":"CD20220601112413MD","brand":{"@type":"Brand","name":"Cider"},"offers":{"@type":"Offer","url":"https://www.shopcider.com/goods/toile-de-jouy-patchy-shirt-dress","priceCurrency":"CAD","price":"44.00","priceValidUntil":"2023-03-07","itemCondition":"https://schema.org/NewCondition","availability":"https://schema.org/InStock"},"aggregateRating":{"@type":"AggregateRating","ratingValue":"4.6","reviewCount":"136"},"review":[{"@type":"Review","datePublished":"2022/12/27","name":"One of my favourite items ordered from Cider. It’s a classy and beautiful design. Got so many compliments on it!","reviewBody":"One of my favourite items ordered from Cider. It’s a classy and beautiful design. Got so many compliments on it!","reviewRating":{"@type":"Rating","ratingValue":"5","bestRating":"5"},"author":{"@type":"Person","name":"c***g"}},{"@type":"Review","datePublished":"2022/11/14","name":"OBSESSED. \\n\\nWould say I ordered thinking it would be snug but it\'s a bit larger around waste. But it\'s super comfy and get loads of comments about how lovely it is.","reviewBody":"OBSESSED. \\n\\nWould say I ordered thinking it would be snug but it\'s a bit larger around waste. But it\'s super comfy and get loads of comments about how lovely it is.","reviewRating":{"@type":"Rating","ratingValue":"5","bestRating":"5"},"author":{"@type":"Person","name":"l***7"}},{"@type":"Review","datePublished":"2022/11/14","name":"slightly tight in the arms and the corset part, but that was to be expected for a corset. super cute length, the neckline is cute as well. sleeves are a bit hard to work with cause they slide up a bit if youre moving your arms a lot (i wore this for my college graduation so my arms were moving a lot, with pictures and waving, etc.) but thats just me nitpicking, i loce this dress and im super happy i bought it","reviewBody":"slightly tight in the arms and the corset part, but that was to be expected for a corset. super cute length, the neckline is cute as well. sleeves are a bit hard to work with cause they slide up a bit if youre moving your arms a lot (i wore this for my college graduation so my arms were moving a lot, with pictures and waving, etc.) but thats just me nitpicking, i loce this dress and im super happy i bought it","reviewRating":{"@type":"Rating","ratingValue":"5","bestRating":"5"},"author":{"@type":"Person","name":"a***h"}},{"@type":"Review","datePublished":"2022/11/14","name":"Dress is really cute and I really like the pretty pattern patch on it.  Personally I think it looks really good with gray high boots. Fit perfectly although it was a little hard to get on. It’s kinda see through but not completely. Goes well with winter and summer themes. Plan on wearing this casually to school and seeing what other people think.","reviewBody":"Dress is really cute and I really like the pretty pattern patch on it.  Personally I think it looks really good with gray high boots. Fit perfectly although it was a little hard to get on. It’s kinda see through but not completely. Goes well with winter and summer themes. Plan on wearing this casually to school and seeing what other people think.","reviewRating":{"@type":"Rating","ratingValue":"5","bestRating":"5"},"author":{"@type":"Person","name":"l***9"}},{"@type":"Review","datePublished":"2022/11/14","name":"This dress is very good in size, it is very beautiful to wear, it makes me look very good, the material is also very thin, it is very suitable for hot summer, it is also very easy to clean, it will not wrinkle, and the shipment is also very fast, which is very worth buying! I love wearing this brand of clothes, so dazzling and charming!","reviewBody":"This dress is very good in size, it is very beautiful to wear, it makes me look very good, the material is also very thin, it is very suitable for hot summer, it is also very easy to clean, it will not wrinkle, and the shipment is also very fast, which is very worth buying! I love wearing this brand of clothes, so dazzling and charming!","reviewRating":{"@type":"Rating","ratingValue":"5","bestRating":"5"},"author":{"@type":"Person","name":"v***3"}},{"@type":"Review","datePublished":"2022/11/09","name":"It’s a bit see trough but the dress is perfect. It has a zipper on the size, which I didn’t see immediately but helps a lot. Perfect in Winter and early Summer. ","reviewBody":"It’s a bit see trough but the dress is perfect. It has a zipper on the size, which I didn’t see immediately but helps a lot. Perfect in Winter and early Summer. ","reviewRating":{"@type":"Rating","ratingValue":"4","bestRating":"5"},"author":{"@type":"Person","name":"s***e"}},{"@type":"Review","datePublished":"2022/11/02","name":"I ordered this dress for a Halloween party and I absolutely loved it! I got lots of compliments on the dress too. The only downside is taking it off because it gets stuck on the curves... Also, if you plan to wear it without a bra beware that your neck probably has to carry the weight of your breasts. So if you\'re heavy chested (like me) your neck could get a bit sore. Nevertheless I\'m really happy I got it! ","reviewBody":"I ordered this dress for a Halloween party and I absolutely loved it! I got lots of compliments on the dress too. The only downside is taking it off because it gets stuck on the curves... Also, if you plan to wear it without a bra beware that your neck probably has to carry the weight of your breasts. So if you\'re heavy chested (like me) your neck could get a bit sore. Nevertheless I\'m really happy I got it! ","reviewRating":{"@type":"Rating","ratingValue":"4","bestRating":"5"},"author":{"@type":"Person","name":"x***n"}},{"@type":"Review","datePublished":"2022/09/29","name":"Absolutely love this dress, got so so so many compliments on it and it’s now my favourite outfit! It’s very flattering, especially if you have a pear or hourglass shaped body like me. I wore it on holiday and the photos came out amazing! I want to buy more like this style for sure. ","reviewBody":"Absolutely love this dress, got so so so many compliments on it and it’s now my favourite outfit! It’s very flattering, especially if you have a pear or hourglass shaped body like me. I wore it on holiday and the photos came out amazing! I want to buy more like this style for sure. ","reviewRating":{"@type":"Rating","ratingValue":"5","bestRating":"5"},"author":{"@type":"Person","name":"m***n"}},{"@type":"Review","datePublished":"2022/09/28","name":"I’m 5’7” 185lbs with a D-DD chest and usually wear a medium in everything. I decided to get a large just to make sure it wasn’t too small/ too short/ I wasn’t constricted. It’s a beautiful, high quality dress exactly as pictured. If you have a larger chest, I would say even go up 2 sizes if you want some breathing room. It’s high quality thick material but there is no stretch or give. It’s a very well constructed almost tailored dress, so if you like things that are lose fitting this isn’t for you. It’s snug but not tight and everything fits well. The top portion is very constructed almost like a corset, so I would say a bra isn’t necessary however the white is still a little see through so maybe a slip. It’s not too short and skimpy either ! This is the first purchase I’ve made from cider and I’ll definitely be buying more! I got the dress for my engagement pictures and it’s perfect! If you size up and it’s a little loose it’ll definitely still lay correctly. ","reviewBody":"I’m 5’7” 185lbs with a D-DD chest and usually wear a medium in everything. I decided to get a large just to make sure it wasn’t too small/ too short/ I wasn’t constricted. It’s a beautiful, high quality dress exactly as pictured. If you have a larger chest, I would say even go up 2 sizes if you want some breathing room. It’s high quality thick material but there is no stretch or give. It’s a very well constructed almost tailored dress, so if you like things that are lose fitting this isn’t for you. It’s snug but not tight and everything fits well. The top portion is very constructed almost like a corset, so I would say a bra isn’t necessary however the white is still a little see through so maybe a slip. It’s not too short and skimpy either ! This is the first purchase I’ve made from cider and I’ll definitely be buying more! I got the dress for my engagement pictures and it’s perfect! If you size up and it’s a little loose it’ll definitely still lay correctly. ","reviewRating":{"@type":"Rating","ratingValue":"5","bestRating":"5"},"author":{"@type":"Person","name":"w***k"}},{"@type":"Review","datePublished":"2022/09/22","name":"Super cute! Fits perfectly, great quality ","reviewBody":"Super cute! Fits perfectly, great quality ","reviewRating":{"@type":"Rating","ratingValue":"5","bestRating":"5"},"author":{"@type":"Person","name":"2***w"
