"@context":"https://schema.org/","@type":"Product","name":"Curve & Plus Patchwork Knit Ripped Midi Dress","image":["https://img1.shopcider.com/product/1665561465000-xDrftb.jpg"],"url":"https://www.shopcider.com/goods/curve-plus-patchwork-knit-ripped-midi-dress","description":"Curve & Plus Patchwork Knit Ripped Midi Dress","sku":"CD20220819161613KD","brand":{"@type":"Brand","name":"Cider"},"offers":{"@type":"Offer","url":"https://www.shopcider.com/goods/curve-plus-patchwork-knit-ripped-midi-dress","priceCurrency":"CAD","price":"36.00","priceValidUntil":"2023-03-07","itemCondition":"https://schema.org/NewCondition","availability":"https://schema.org/InStock"},"aggregateRating":{"@type":"AggregateRating","ratingValue":"4.6","reviewCount":"78"},"review":[{"@type":"Review","datePublished":"2023/01/24","name":"broke up with my ex in this😌💅🏻","reviewBody":"broke up with my ex in this😌💅🏻","reviewRating":{"@type":"Rating","ratingValue":"4","bestRating":"5"},"author":{"@type":"Person","name":"m***3"}},{"@type":"Review","datePublished":"2023/01/12","name":"I am obsessed with this , it’s so flattering and cosy xo if they sold the other colours in the curve section , I’d buy them all xo you can dress it up or down and looks amazing with a belt xo ","reviewBody":"I am obsessed with this , it’s so flattering and cosy xo if they sold the other colours in the curve section , I’d buy them all xo you can dress it up or down and looks amazing with a belt xo ","reviewRating":{"@type":"Rating","ratingValue":"5","bestRating":"5"},"author":{"@type":"Person","name":"s***5"}},{"@type":"Review","datePublished":"2023/01/10","name":"Love the material, very very soft woolly but not itchy at all.\\nIt\'s little bit on long on me (I\'m 5\'5) and sleeves are way to long too but I still made it work 🥰","reviewBody":"Love the material, very very soft woolly but not itchy at all.\\nIt\'s little bit on long on me (I\'m 5\'5) and sleeves are way to long too but I still made it work 🥰","reviewRating":{"@type":"Rating","ratingValue":"4","bestRating":"5"},"author":{"@type":"Person","name":"m***i"}},{"@type":"Review","datePublished":"2022/12/30","name":"Loved this dress. Word tights and a tank top under with black boots! Fits true to size. ","reviewBody":"Loved this dress. Word tights and a tank top under with black boots! Fits true to size. ","reviewRating":{"@type":"Rating","ratingValue":"5","bestRating":"5"},"author":{"@type":"Person","name":"c***7"}},{"@type":"Review","datePublished":"2022/12/08","name":"Love love love !!!! Super soft and comfy! ","reviewBody":"Love love love !!!! Super soft and comfy! ","reviewRating":{"@type":"Rating","ratingValue":"5","bestRating":"5"},"author":{"@type":"Person","name":"s***d"}},{"@type":"Review","datePublished":"2022/11/29","name":"I love this dress , I got lots of compliments and it’s very comfortable. ","reviewBody":"I love this dress , I got lots of compliments and it’s very comfortable. ","reviewRating":{"@type":"Rating","ratingValue":"5","bestRating":"5"},"author":{"@type":"Person","name":"w***0"}},{"@type":"Review","datePublished":"2022/11/28","name":"I recently ordered this dress and was so cute! Was super stretchy but also form fitting! The fabric feels nice and not cheap, and the colors are true to the online photos! It was a bit more see through than I was anticipating so definitely wear enough underneath. This is perfect for concerts and parties as it is super breathable! Overall I really enjoy this dress ","reviewBody":"I recently ordered this dress and was so cute! Was super stretchy but also form fitting! The fabric feels nice and not cheap, and the colors are true to the online photos! It was a bit more see through than I was anticipating so definitely wear enough underneath. This is perfect for concerts and parties as it is super breathable! Overall I really enjoy this dress ","reviewRating":{"@type":"Rating","ratingValue":"4","bestRating":"5"},"author":{"@type":"Person","name":"s***n"}},{"@type":"Review","datePublished":"2022/11/05","name":"Very cute! And I loved the way it fit on me.  it\'s a perfect fall dress and can go edgy or soft depending on how you accesssorize. However be warned it does NOT come with a black slipdress for underneath. Luckily I had a super long cami that i could make work instead. I\'m a US size 18/20 and a 16/18 on top.","reviewBody":"Very cute! And I loved the way it fit on me.  it\'s a perfect fall dress and can go edgy or soft depending on how you accesssorize. However be warned it does NOT come with a black slipdress for underneath. Luckily I had a super long cami that i could make work instead. I\'m a US size 18/20 and a 16/18 on top.","reviewRating":{"@type":"Rating","ratingValue":"5","bestRating":"5"},"author":{"@type":"Person","name":"l***z"}},{"@type":"Review","datePublished":"2022/10/29","name":"super super cute!!! definitely don’t snag it on anything haha. Soft, relatively stretchy, not itchy at all. got compliments everywhere i went!! i’m a size 20 in bottoms, 18 on top and a 2x fit great. ","reviewBody":"super super cute!!! definitely don’t snag it on anything haha. Soft, relatively stretchy, not itchy at all. got compliments everywhere i went!! i’m a size 20 in bottoms, 18 on top and a 2x fit great. ","reviewRating":{"@type":"Rating","ratingValue":"5","bestRating":"5"},"author":{"@type":"Person","name":"k***n"}},{"@type":"Review","datePublished":"2022/10/19","name":"Good quality and looks exactly like on photo.","reviewBody":"Good quality and looks exactly like on photo.","reviewRating":{"@type":"Rating","ratingValue":"5","bestRating":"5"},"author":{"@type":"Person","name":"m***n"
"@context":"https://schema.org/","@type":"Product","name":"Satin Lace Sweetheart Knotted Mini Dress","image":["https://img1.shopcider.com/product/1667312703000-N8MpWG.jpg"],"url":"https://www.shopcider.com/goods/satin-lace-sweetheart-knotted-mini-dress","description":"Satin Lace Sweetheart Knotted Mini Dress","sku":"CD20221012191240MD","brand":{"@type":"Brand","name":"Cider"},"offers":{"@type":"Offer","url":"https://www.shopcider.com/goods/satin-lace-sweetheart-knotted-mini-dress","priceCurrency":"CAD","price":"19.00","priceValidUntil":"2023-03-07","itemCondition":"https://schema.org/NewCondition","availability":"https://schema.org/InStock"},"aggregateRating":{"@type":"AggregateRating","ratingValue":"4.8","reviewCount":"23"},"review":[{"@type":"Review","datePublished":"2023/01/13","name":"Me gusto mucho es elasticado es un basico para usar siempre y es muuy lindo estoy contenta.","reviewBody":"Me gusto mucho es elasticado es un basico para usar siempre y es muuy lindo estoy contenta.","reviewRating":{"@type":"Rating","ratingValue":"5","bestRating":"5"},"author":{"@type":"Person","name":"j***r"}},{"@type":"Review","datePublished":"2023/01/03","name":"Gorgeous dress! Shame the lowest size they do is an xs, I usually take a xxs so this dress is a little baggy around the waist but apart from that its wonderful! A great dupe for the Houseofcb Adriana dress <3","reviewBody":"Gorgeous dress! Shame the lowest size they do is an xs, I usually take a xxs so this dress is a little baggy around the waist but apart from that its wonderful! A great dupe for the Houseofcb Adriana dress <3","reviewRating":{"@type":"Rating","ratingValue":"5","bestRating":"5"},"author":{"@type":"Person","name":"c***e"}},{"@type":"Review","datePublished":"2022/12/30","name":"Parcel got on time. Everything looks good. ","reviewBody":"Parcel got on time. Everything looks good. ","reviewRating":{"@type":"Rating","ratingValue":"5","bestRating":"5"},"author":{"@type":"Person","name":"a***m"}},{"@type":"Review","datePublished":"2023/02/02","name":"So cute! I’m in love! :)","reviewBody":"So cute! I’m in love! :)","reviewRating":{"@type":"Rating","ratingValue":"5","bestRating":"5"},"author":{"@type":"Person","name":"r***h"}},{"@type":"Review","datePublished":"2023/01/25","name":"Was worried about it being small but is perfectly true to size, super comfortable and flattering too","reviewBody":"Was worried about it being small but is perfectly true to size, super comfortable and flattering too","reviewRating":{"@type":"Rating","ratingValue":"5","bestRating":"5"},"author":{"@type":"Person","name":"m***a"}},{"@type":"Review","datePublished":"2023/01/10","name":"super cute dress. kind of short but overall super cute. ","reviewBody":"super cute dress. kind of short but overall super cute. ","reviewRating":{"@type":"Rating","ratingValue":"4","bestRating":"5"},"author":{"@type":"Person","name":"a***4"}},{"@type":"Review","datePublished":"2023/01/05","name":"I was in between sizes an xs and a small. I got the small and the straps are loose. Great quality dress but going to try the xs","reviewBody":"I was in between sizes an xs and a small. I got the small and the straps are loose. Great quality dress but going to try the xs","reviewRating":{"@type":"Rating","ratingValue":"5","bestRating":"5"},"author":{"@type":"Person","name":"e***n"}},{"@type":"Review","datePublished":"2023/01/02","name":"Perfect quality, very cute style ! Runs true to size . ","reviewBody":"Perfect quality, very cute style ! Runs true to size . ","reviewRating":{"@type":"Rating","ratingValue":"5","bestRating":"5"},"author":{"@type":"Person","name":"g***d"}},{"@type":"Review","datePublished":"2023/01/02","name":"So cute exactly like photo! Straps a little loose but can sew them :)","reviewBody":"So cute exactly like photo! Straps a little loose but can sew them :)","reviewRating":{"@type":"Rating","ratingValue":"5","bestRating":"5"},"author":{"@type":"Person","name":"a***y"}},{"@type":"Review","datePublished":"2022/12/31","name":"Perfect ","reviewBody":"Perfect ","reviewRating":{"@type":"Rating","ratingValue":"5","bestRating":"5"},"author":{"@type":"Person","name":"j***k"
"@context":"https://schema.org/","@type":"Product","name":"Houndstooth Square Neck Button Up Mini Dress","image":["https://img1.shopcider.com/product/1666889997000-K73iB3.jpg"],"url":"https://www.shopcider.com/goods/houndstooth-square-neck-button-up-mini-dress","description":"Houndstooth Square Neck Button Up Mini Dress","sku":"CD20221013191519MD","brand":{"@type":"Brand","name":"Cider"},"offers":{"@type":"Offer","url":"https://www.shopcider.com/goods/houndstooth-square-neck-button-up-mini-dress","priceCurrency":"CAD","price":"33.00","priceValidUntil":"2023-03-07","itemCondition":"https://schema.org/NewCondition","availability":"https://schema.org/InStock"},"aggregateRating":{"@type":"AggregateRating","ratingValue":"4.1","reviewCount":"80"},"review":[{"@type":"Review","datePublished":"2023/01/13","name":"I really like this. The material is thin, but it’s really comfy and looks cute paired with lots of different blouses.","reviewBody":"I really like this. The material is thin, but it’s really comfy and looks cute paired with lots of different blouses.","reviewRating":{"@type":"Rating","ratingValue":"5","bestRating":"5"},"author":{"@type":"Person","name":"K***i"}},{"@type":"Review","datePublished":"2022/12/31","name":"Very cute dress, looks great when layered. Just a few things to keep in mind:\\n1.) The dress is smaller in the waist area. I would size up if you’re looking to have more room. I was fine with the way it fit me. \\n2.) Larger busted women beware! I am a 36C and had a hard time buttoning the top button. I’m fine leaving it unbuttoned, I think it still looks cute. \\n3.) The straps are a bit loose. They are not to the point where they’re falling, but this may be the case for smaller bodies. ","reviewBody":"Very cute dress, looks great when layered. Just a few things to keep in mind:\\n1.) The dress is smaller in the waist area. I would size up if you’re looking to have more room. I was fine with the way it fit me. \\n2.) Larger busted women beware! I am a 36C and had a hard time buttoning the top button. I’m fine leaving it unbuttoned, I think it still looks cute. \\n3.) The straps are a bit loose. They are not to the point where they’re falling, but this may be the case for smaller bodies. ","reviewRating":{"@type":"Rating","ratingValue":"4","bestRating":"5"},"author":{"@type":"Person","name":"9***c"}},{"@type":"Review","datePublished":"2022/12/30","name":"I could’ve gone for a normal large cause the fabric is stretchy! It’s very cute and something I can wear for the fall and winter! Only problem is that the buttons are a little flimsy meaning they can open at any time so be careful ","reviewBody":"I could’ve gone for a normal large cause the fabric is stretchy! It’s very cute and something I can wear for the fall and winter! Only problem is that the buttons are a little flimsy meaning they can open at any time so be careful ","reviewRating":{"@type":"Rating","ratingValue":"4","bestRating":"5"},"author":{"@type":"Person","name":"l***5"}},{"@type":"Review","datePublished":"2023/02/04","name":"Fit perfectly and with a turtleneck ","reviewBody":"Fit perfectly and with a turtleneck ","reviewRating":{"@type":"Rating","ratingValue":"5","bestRating":"5"},"author":{"@type":"Person","name":"n***a"}},{"@type":"Review","datePublished":"2023/01/31","name":"So cute! ","reviewBody":"So cute! ","reviewRating":{"@type":"Rating","ratingValue":"5","bestRating":"5"},"author":{"@type":"Person","name":"j***8"}},{"@type":"Review","datePublished":"2023/01/27","name":"It’s quite cute on! Wish the top part was a bit more figure hugging but overall it’s nice ","reviewBody":"It’s quite cute on! Wish the top part was a bit more figure hugging but overall it’s nice ","reviewRating":{"@type":"Rating","ratingValue":"4","bestRating":"5"},"author":{"@type":"Person","name":"a***9"}},{"@type":"Review","datePublished":"2023/01/26","name":"Very nice","reviewBody":"Very nice","reviewRating":{"@type":"Rating","ratingValue":"4","bestRating":"5"},"author":{"@type":"Person","name":"c***9"}},{"@type":"Review","datePublished":"2023/01/20","name":"lovely item but was slightly too small. Big chested girls should size up.","reviewBody":"lovely item but was slightly too small. Big chested girls should size up.","reviewRating":{"@type":"Rating","ratingValue":"4","bestRating":"5"},"author":{"@type":"Person","name":"b***7"}},{"@type":"Review","datePublished":"2023/01/20","name":"fabric is a little thinner than expected but still very nice ","reviewBody":"fabric is a little thinner than expected but still very nice ","reviewRating":{"@type":"Rating","ratingValue":"4","bestRating":"5"},"author":{"@type":"Person","name":"a***e"}},{"@type":"Review","datePublished":"2023/01/17","name":"I love this, it looks super cute, however it is too tight around my breast. But there is a extra button sent with the dress so I\'ll just add it to solve the gaping between the two first buttons. I think if you\'re a bit more flatchested this will look great on you. ","reviewBody":"I love this, it looks super cute, however it is too tight around my breast. But there is a extra button sent with the dress so I\'ll just add it to solve the gaping between the two first buttons. I think if you\'re a bit more flatchested this will look great on you. ","reviewRating":{"@type":"Rating","ratingValue":"5","bestRating":"5"},"author":{"@type":"Person","name":"n***a"
"@context":"https://schema.org/","@type":"Product","name":"Curve&Plus Button Down Corset Shirt Dress","image":["https://img1.shopcider.com/product/1649401992000-5mTQAH.jpg"],"url":"https://www.shopcider.com/goods/curve-plus-button-down-corset-shirt-dress","description":"Curve&Plus Button Down Corset Shirt Dress","sku":"CD2021091517832MD","brand":{"@type":"Brand","name":"Cider"},"offers":{"@type":"Offer","url":"https://www.shopcider.com/goods/curve-plus-button-down-corset-shirt-dress","priceCurrency":"CAD","price":"33.00","priceValidUntil":"2023-03-07","itemCondition":"https://schema.org/NewCondition","availability":"https://schema.org/InStock"},"aggregateRating":{"@type":"AggregateRating","ratingValue":"4.6","reviewCount":"134"},"review":[{"@type":"Review","datePublished":"2023/01/08","name":"I feel like I read on here to size up on this one but it ended up being a bit too big. So possibly just go with your actual size on this one. It worked out alright though and really made my holiday outfit come together! I will be keeping this size.","reviewBody":"I feel like I read on here to size up on this one but it ended up being a bit too big. So possibly just go with your actual size on this one. It worked out alright though and really made my holiday outfit come together! I will be keeping this size.","reviewRating":{"@type":"Rating","ratingValue":"4","bestRating":"5"},"author":{"@type":"Person","name":"b***s"}},{"@type":"Review","datePublished":"2022/12/17","name":"I’m so happy about it! It comes in tight under the bust and just snatched you. I’m normally a 2x in shirts/pants. I’m 210lbs, 5”7, 46 DD. PARDON MY ROOM HAHAAHAH.","reviewBody":"I’m so happy about it! It comes in tight under the bust and just snatched you. I’m normally a 2x in shirts/pants. I’m 210lbs, 5”7, 46 DD. PARDON MY ROOM HAHAAHAH.","reviewRating":{"@type":"Rating","ratingValue":"5","bestRating":"5"},"author":{"@type":"Person","name":"v***3"}},{"@type":"Review","datePublished":"2022/12/12","name":"This dress has become a staple in my life as it is easily dressed up or down depending on what you’re doing that day!","reviewBody":"This dress has become a staple in my life as it is easily dressed up or down depending on what you’re doing that day!","reviewRating":{"@type":"Rating","ratingValue":"5","bestRating":"5"},"author":{"@type":"Person","name":"b***p"}},{"@type":"Review","datePublished":"2022/12/07","name":"good size, nice material, fits very well ,177 cm 115kg","reviewBody":"good size, nice material, fits very well ,177 cm 115kg","reviewRating":{"@type":"Rating","ratingValue":"5","bestRating":"5"},"author":{"@type":"Person","name":"c***a"}},{"@type":"Review","datePublished":"2022/12/03","name":"I usually go for a 0X but I’m an apple shape so I sized up and it fits perfect. For reference I’m a XL-0X in tops (38DD) and a 31/12 in jeans (Levi’s/ American eagle). Only issue is that it’s super super see through 😬","reviewBody":"I usually go for a 0X but I’m an apple shape so I sized up and it fits perfect. For reference I’m a XL-0X in tops (38DD) and a 31/12 in jeans (Levi’s/ American eagle). Only issue is that it’s super super see through 😬","reviewRating":{"@type":"Rating","ratingValue":"4","bestRating":"5"},"author":{"@type":"Person","name":"J***l"}},{"@type":"Review","datePublished":"2022/11/29","name":"super cute, brings a long line look with a snatched waist. made for a taller woman, very large in arm, shoulder and neck. ","reviewBody":"super cute, brings a long line look with a snatched waist. made for a taller woman, very large in arm, shoulder and neck. ","reviewRating":{"@type":"Rating","ratingValue":"4","bestRating":"5"},"author":{"@type":"Person","name":"w***s"}},{"@type":"Review","datePublished":"2022/11/26","name":"I luv this dress a lot especially the waist part but bec of my chest size,,, every time I sit down the middle buttons are opening ","reviewBody":"I luv this dress a lot especially the waist part but bec of my chest size,,, every time I sit down the middle buttons are opening ","reviewRating":{"@type":"Rating","ratingValue":"5","bestRating":"5"},"author":{"@type":"Person","name":"f***2"}},{"@type":"Review","datePublished":"2022/11/26","name":"Its a bit too small but its okay.","reviewBody":"Its a bit too small but its okay.","reviewRating":{"@type":"Rating","ratingValue":"3","bestRating":"5"},"author":{"@type":"Person","name":"s***5"}},{"@type":"Review","datePublished":"2022/11/19","name":"I wore this as an oversized shirt and tucked it into pants and you couldn’t tell it was a dress! Very thin and good for layering!","reviewBody":"I wore this as an oversized shirt and tucked it into pants and you couldn’t tell it was a dress! Very thin and good for layering!","reviewRating":{"@type":"Rating","ratingValue":"5","bestRating":"5"},"author":{"@type":"Person","name":"m***2"}},{"@type":"Review","datePublished":"2022/11/19","name":"Love this dress ! Styled it with a corset and boots for a cute fall brunch fit. The arms are a bit long. But I’m guessing that’s just the style of it. I like how tight fitting the waist is, then flares out. Would also wear it without a corset. ","reviewBody":"Love this dress ! Styled it with a corset and boots for a cute fall brunch fit. The arms are a bit long. But I’m guessing that’s just the style of it. I like how tight fitting the waist is, then flares out. Would also wear it without a corset. ","reviewRating":{"@type":"Rating","ratingValue":"5","bestRating":"5"},"author":{"@type":"Person","name":"j***r"
"@context":"https://schema.org/","@type":"Product","name":"Curve & Plus Solid Knitted Cami Split Midi Dress & Crop Top","image":["https://img1.shopcider.com/product/1669552292000-RH7RXk.jpg"],"url":"https://www.shopcider.com/goods/curve-plus-solid-knitted-cami-split-midi-dress-crop-top","description":"Curve & Plus Solid Knitted Cami Split Midi Dress & Crop Top","sku":"CD20221027200831KD","brand":{"@type":"Brand","name":"Cider"},"offers":{"@type":"Offer","url":"https://www.shopcider.com/goods/curve-plus-solid-knitted-cami-split-midi-dress-crop-top","priceCurrency":"CAD","price":"49.00","priceValidUntil":"2023-03-07","itemCondition":"https://schema.org/NewCondition","availability":"https://schema.org/InStock"},"aggregateRating":{"@type":"AggregateRating","ratingValue":"4.9","reviewCount":"15"},"review":[{"@type":"Review","datePublished":"2022/12/22","name":"Such a beautiful and warm dress and very good quality ","reviewBody":"Such a beautiful and warm dress and very good quality ","reviewRating":{"@type":"Rating","ratingValue":"5","bestRating":"5"},"author":{"@type":"Person","name":"a***e"}},{"@type":"Review","datePublished":"2023/02/04","name":"Honestly such an adorable dress, can\'t wait to wear it out.","reviewBody":"Honestly such an adorable dress, can\'t wait to wear it out.","reviewRating":{"@type":"Rating","ratingValue":"4","bestRating":"5"},"author":{"@type":"Person","name":"l***y"}},{"@type":"Review","datePublished":"2023/01/20","name":"Such a cute fit, perfect for a day or night out in this cold U.K. weather ","reviewBody":"Such a cute fit, perfect for a day or night out in this cold U.K. weather ","reviewRating":{"@type":"Rating","ratingValue":"5","bestRating":"5"},"author":{"@type":"Person","name":"W***y"}},{"@type":"Review","datePublished":"2023/01/09","name":"amazing, I love it so much. fits perfectly and it looks amazing on. not see through","reviewBody":"amazing, I love it so much. fits perfectly and it looks amazing on. not see through","reviewRating":{"@type":"Rating","ratingValue":"5","bestRating":"5"},"author":{"@type":"Person","name":"s***s"}},{"@type":"Review","datePublished":"2023/01/05","name":"So comfy and 100% like the image. I’m in love ","reviewBody":"So comfy and 100% like the image. I’m in love ","reviewRating":{"@type":"Rating","ratingValue":"5","bestRating":"5"},"author":{"@type":"Person","name":"a***2"}},{"@type":"Review","datePublished":"2023/01/03","name":"amazing quality,stretchy material ","reviewBody":"amazing quality,stretchy material ","reviewRating":{"@type":"Rating","ratingValue":"5","bestRating":"5"},"author":{"@type":"Person","name":"b***i"}},{"@type":"Review","datePublished":"2022/12/24","name":"Favorite dress right now! So fancy","reviewBody":"Favorite dress right now! So fancy","reviewRating":{"@type":"Rating","ratingValue":"5","bestRating":"5"},"author":{"@type":"Person","name":"n***0"}},{"@type":"Review","datePublished":"2022/12/19","name":"It’s very flattering, and cozy! Side note: If you’re taller you might have to clip the slit just a bit, I had to do that","reviewBody":"It’s very flattering, and cozy! Side note: If you’re taller you might have to clip the slit just a bit, I had to do that","reviewRating":{"@type":"Rating","ratingValue":"5","bestRating":"5"},"author":{"@type":"Person","name":"a***c"}},{"@type":"Review","datePublished":"2022/12/13","name":"The only thing that worries me about this dress is the thin sleeves. Other than that it\'s perfect","reviewBody":"The only thing that worries me about this dress is the thin sleeves. Other than that it\'s perfect","reviewRating":{"@type":"Rating","ratingValue":"5","bestRating":"5"},"author":{"@type":"Person","name":"c***r"}},{"@type":"Review","datePublished":"2023/01/13","name":"This sweater material is extremely stretchy, and runs big, I could’ve def sized down, it also clings to the body, the height of the split isn’t too revealing, love the dress without straps, the added jacket made the outfit pop! purchased this item as a part of a haul I did (YT: Simply Mz Kira)","reviewBody":"This sweater material is extremely stretchy, and runs big, I could’ve def sized down, it also clings to the body, the height of the split isn’t too revealing, love the dress without straps, the added jacket made the outfit pop! purchased this item as a part of a haul I did (YT: Simply Mz Kira)","reviewRating":{"@type":"Rating","ratingValue":"5","bestRating":"5"},"author":{"@type":"Person","name":"m***3"
